{
  "schemaVersion": 1,
  "worldId": "bridge1",
  "rulesetVersion": "rules-v2",
  "simulationVersion": "0.0.2",
  "streamId": "integration-gate1-resync",
  "sequence": 1,
  "worldTick": 1825,
  "throughEventId": "bridge1:event:00000052",
  "controlledActorId": "bridge1:agent:00000001",
  "actors": [
    {
      "actorId": "bridge1:agent:00000001",
      "displayName": "bridge1:agent:00000001",
      "location": {
        "regionId": "bridge1:region:00000001"
      },
      "behaviorStatus": "active",
      "lifeStatus": "alive",
      "cultivation": {
        "hasMethod": false,
        "completedSessions": 0
      },
      "appearanceSeed": "b8863f9ca2476630f35648bd01978e43e0f9e970908708e921226d23ee4b852e",
      "currentAction": null
    },
    {
      "actorId": "bridge1:agent:00000002",
      "displayName": "bridge1:agent:00000002",
      "location": {
        "regionId": "bridge1:region:00000001"
      },
      "behaviorStatus": "active",
      "lifeStatus": "alive",
      "cultivation": {
        "hasMethod": true,
        "completedSessions": 4
      },
      "appearanceSeed": "33a8ef1ef187cc7160a85c038c0b579675a7cc000fa0c6b1c9f3488d903ee45f",
      "currentAction": null
    },
    {
      "actorId": "bridge1:agent:00000003",
      "displayName": "bridge1:agent:00000003",
      "location": {
        "regionId": "bridge1:region:00000001"
      },
      "behaviorStatus": "active",
      "lifeStatus": "alive",
      "cultivation": {
        "hasMethod": true,
        "completedSessions": 3
      },
      "appearanceSeed": "428d02a6465699f75c976541de051d8c982e72fb16773eb04965e8fe735859c3",
      "currentAction": null
    }
  ],
  "actions": []
}
