{
  "schemaVersion": 1,
  "worldId": "g1abridge",
  "rulesetVersion": "rules-v2",
  "simulationVersion": "0.0.2",
  "streamId": "g1a-count-5",
  "sequence": 1,
  "worldTick": 4380,
  "throughEventId": "g1abridge:event:00000050",
  "controlledActorId": "g1abridge:agent:00000001",
  "actors": [
    {
      "actorId": "g1abridge:agent:00000001",
      "displayName": "g1abridge:agent:00000001",
      "location": {
        "regionId": "g1abridge:region:00000001"
      },
      "behaviorStatus": "active",
      "lifeStatus": "alive",
      "cultivation": {
        "hasMethod": false,
        "completedSessions": 0
      },
      "appearanceSeed": "d4c9146f6f43cfac87ed63dc29b3bd42452092f816e56c8a71bf7960f174020b",
      "currentAction": null
    },
    {
      "actorId": "g1abridge:agent:00000002",
      "displayName": "g1abridge:agent:00000002",
      "location": {
        "regionId": "g1abridge:region:00000001"
      },
      "behaviorStatus": "active",
      "lifeStatus": "alive",
      "cultivation": {
        "hasMethod": false,
        "completedSessions": 0
      },
      "appearanceSeed": "b9e9188ea446effdb7af81e867525493bfb6dc7d03c5642a09d408f654e55449",
      "currentAction": null
    },
    {
      "actorId": "g1abridge:agent:00000003",
      "displayName": "g1abridge:agent:00000003",
      "location": {
        "regionId": "g1abridge:region:00000001"
      },
      "behaviorStatus": "active",
      "lifeStatus": "alive",
      "cultivation": {
        "hasMethod": false,
        "completedSessions": 0
      },
      "appearanceSeed": "80cd092560c355d6ea023ddf79f4e88dc4dc6a2a6b196004c9d93c36ca8ad333",
      "currentAction": null
    },
    {
      "actorId": "g1abridge:agent:00000004",
      "displayName": "g1abridge:agent:00000004",
      "location": {
        "regionId": "g1abridge:region:00000001"
      },
      "behaviorStatus": "active",
      "lifeStatus": "alive",
      "cultivation": {
        "hasMethod": false,
        "completedSessions": 0
      },
      "appearanceSeed": "7d24d8aacc5b45b121ef68f0e0f6c821a712dadc9a3f84e2d44916efa5f171b9",
      "currentAction": null
    },
    {
      "actorId": "g1abridge:agent:00000005",
      "displayName": "g1abridge:agent:00000005",
      "location": {
        "regionId": "g1abridge:region:00000001"
      },
      "behaviorStatus": "active",
      "lifeStatus": "alive",
      "cultivation": {
        "hasMethod": false,
        "completedSessions": 0
      },
      "appearanceSeed": "299e623b3b8d53301929a7999766f89aae623fafc9b4ab80069e653a91ca9599",
      "currentAction": null
    }
  ],
  "actions": []
}
